{
  "schema": "cyclone.human_gesture.trace.v1",
  "engine": {"name": "human-gesture", "version": "1"},
  "source": "procedural",
  "gesture_type": "tap",
  "profile": "OFF",
  "viewport": {"width_px": 100.0, "height_px": 200.0},
  "duration_ms": 50,
  "target": {
    "bounds_norm": {"left": 0.2, "top": 0.2, "right": 0.6, "bottom": 0.4}
  },
  "points": [
    {"u": 0.4, "v": 0.3, "t": 0.0}
  ]
}
